{
  "schema_version": "adapter-receipt.v1",
  "receipt_id": "adprcp_attempt1",
  "adapter_id": "adp_hermes_main",
  "receipt_kind": "ATTEMPT_OUTCOME",
  "recorded_at": "2026-09-02T01:00:00Z",
  "attempt_id": "att_abc123",
  "attempt_outcome": {
    "state": "SUCCEEDED",
    "exit_code": 0,
    "evidence_bundle_id": "ev_bundle123",
    "terminal_reason": "complete"
  },
  "content_sha256": "sha256:4d2a47e5f59e0c69b8ac1c0f82d119887219afc5cbe8a1f70562a423cf6cc35c"
}